{
  "schema_version": "0.1",
  "scenario": "S08_layer_only",
  "description": "벽 3개의 레이어만 A-WALL2로 바꾼다(기하 동일).",
  "before_dir": "before",
  "after_dir": "after",
  "expected_pairs": [
    {
      "sheet_no": "A-101",
      "status": "same",
      "match_method": "number",
      "expected_changes": [
        {
          "kind": "modified",
          "etype": "LWPOLYLINE",
          "minor": true,
          "before_handle": "DD",
          "after_handle": "DD",
          "minor_reason": "layer_only",
          "layer": "A-WALL",
          "bbox": [
            20400.0,
            6500.0,
            20600.0,
            27500.0
          ],
          "note": "wall 'part_v1' moved from A-WALL to A-WALL2 (layer only, geometry unchanged)"
        },
        {
          "kind": "modified",
          "etype": "LWPOLYLINE",
          "minor": true,
          "before_handle": "DE",
          "after_handle": "DE",
          "minor_reason": "layer_only",
          "layer": "A-WALL",
          "bbox": [
            31400.0,
            6500.0,
            31600.0,
            27500.0
          ],
          "note": "wall 'part_v2' moved from A-WALL to A-WALL2 (layer only, geometry unchanged)"
        },
        {
          "kind": "modified",
          "etype": "LWPOLYLINE",
          "minor": true,
          "before_handle": "DF",
          "after_handle": "DF",
          "minor_reason": "layer_only",
          "layer": "A-WALL",
          "bbox": [
            8500.0,
            16900.0,
            43500.0,
            17100.0
          ],
          "note": "wall 'part_h' moved from A-WALL to A-WALL2 (layer only, geometry unchanged)"
        }
      ],
      "expected_cluster_count": 0,
      "clean_regions": [
        [
          0.0,
          32000.0,
          84100.0,
          59400.0
        ],
        [
          0.0,
          0.0,
          8000.0,
          59400.0
        ]
      ]
    }
  ]
}
